{
  "repo": "https://github.com/org/payments-api",
  "contact": {
    "team": "payments",
    "email": "payments@example.com"
  },
  "stack": {
    "runtime": "kubernetes",
    "language": "Python 3.12",
    "environments": ["prod"],
    "applications": {
      "payments-api": "Settlement processing — PCI-scoped database access"
    }
  },
  "services": {
    "vault-dynamic-secrets": {
      "datastore": "postgres",
      "access": "read+write settlements schema",
      "constraints": {
        "no_secrets_in_logs": true
      }
    }
  },
  "feedback": {}
}
