{
  "repo": "https://github.com/org/my-app",
  "contact": {
    "team": "my-team",
    "email": "team@example.com"
  },
  "stack": {
    "runtime": "kubernetes",
    "language": "Go 1.22",
    "environments": ["dev", "prod"],
    "applications": {
      "my-service": "Describe what this app does in plain language"
    }
  },
  "services": {
    "vault-dynamic-secrets": {
      "datastore": "postgres",
      "access": "read+write to application schema",
      "environments": ["dev", "prod"],
      "kubernetes": {
        "namespaces": ["my-ns-dev", "my-ns-prod"],
        "service_accounts": ["my-service"],
        "secret_delivery": "vso"
      },
      "constraints": {
        "caches_connection_at_boot": false,
        "connection_pooler": null
      }
    }
  },
  "feedback": {}
}
